{"$schema":"https://json-schema.org/draft/2020-12/schema","$id":"planner-style-reverse-audit.schema.json","type":"object","additionalProperties":false,"required":["audit_id","style_profile_id","role_counts","native_synthetic_visual_count","caption_role_count","citation_role_count","metric_role_count","focus_callout_role_count","connector_semantics_status","uncontrolled_style_override_count","aggregate_status"],"properties":{"audit_id":{"const":"PPA-STYLE-REVERSE-AUDIT-001"},"style_profile_id":{"const":"VSP003"},"role_counts":{"type":"object","additionalProperties":{"type":"integer","minimum":0}},"native_synthetic_visual_count":{"type":"integer","minimum":0},"caption_role_count":{"type":"integer","minimum":0},"citation_role_count":{"type":"integer","minimum":0},"metric_role_count":{"type":"integer","minimum":0},"focus_callout_role_count":{"type":"integer","minimum":0},"connector_semantics_status":{"const":"controlled_native_shape"},"uncontrolled_style_override_count":{"type":"integer","minimum":0},"aggregate_status":{"enum":["pass","fail"]}}}
